AT&T EL52313 3-Handset Expandable Cordless Phone with Answering System & Extra-large Backlit Keys,$52.97,https://www.amazon.com/AT-EL52313-3-Handset-Expandable-Extra-large/dp/B00J9RT5QU/ref=sr_1_36?keywords=phone&qid=1583976779&sr=8-36,4.1,8436,True,AT&T,N/A,1 Handset / 2 Handsets / 3 Handsets / 5 Handsets / Accessory Handset / Expandable / Fixed,"Enjoy a speakerphone that can keep up with your calls. Increase participation by allowing both ends to speak—and be heard—at the same time for conversations that are more true to life. 
 Easy-to-read LCD on the cordless handset. High-contrast black text on a white background provides for an easy-to-read screen to view incoming Caller ID or review call history. The lighted keypad also allows for easy dialing in low-light conditions. 
 Enlarged font and extra-large, backlit keys make the keypad easy to use. This feature is especially helpful for those who are visually impaired. 
 Features digital recording features like 4 minutes of recording time , Call screening , Call intercept Remote access , Message retrieval from handset , Message time stamp 
 By allowing you to add up to 5 handsets using just one jack, the EL51203 is ideal for your busy home or small office (model EL50003 accessory handsets sold separately).",FREE Shipping,FREE Returns,In Stock.,True,N/A,$9.99
Clarity XLC7BT Cordless Amplified Phone,$115.02,https://www.amazon.com/gp/slredirect/picassoRedirect.html/ref=pa_sp_btf_aps_sr_pg2_1?ie=UTF8&adId=A006150214DVMMK1EZN4N&url=%2FClarity-XLC7BT-Cordless-Amplified-Phone%2Fdp%2FB076JR3QPG%2Fref%3Dsr_1_37_sspa%3Fkeywords%3Dphone%26qid%3D1583976779%26sr%3D8-37-spons%26psc%3D1%26smid%3DAYSGXV7QRGP7K&qualifier=1583976779&id=5103388748235808&widgetName=sp_btf,4.5,10,False,Clarity,N/A,N/A,"50 DECIBELS OF AMPLIFICATION AND FOUR (4) TONE SETTINGS FOR CELLPHONE CALLS AT HOME 
 PAIR UP TO TWO (2) BLUETOOTH DEVICES 
 SIMPLE, EASY-TO-USE DESIGN 
 EXPANDABLE UP TO THREE (3) EXTRA HANDSETS (XLC7HS) 
 Weight: .5 pounds",N/A,N/A,In Stock.,True,N/A,$29.99
"Home Intuition Amplified Single Line Corded Desk Telephone with Extra Loud Ringer, Black",$39.95,https://www.amazon.com/gp/slredirect/picassoRedirect.html/ref=pa_sp_btf_aps_sr_pg2_2?ie=UTF8&adId=A10102809F6SQ3JY3JJ6&url=%2FHome-Intuition-Amplified-Single-Telephone%2Fdp%2FB079J9JB2D%2Fref%3Dsr_1_38_sspa%3Fkeywords%3Dphone%26qid%3D1583976779%26sr%3D8-38-spons%26psc%3D1&qualifier=1583976779&id=5103388748235808&widgetName=sp_btf,3.9,67,False,Home Intuition,N/A,N/A,"Vintage old school retro style single line telephone with 9 foot cord 
 Double-Gong Ringer with Volume Control 
 Works with Hearing Aids 
 Great as a Backup Phone for Power Outages 
 Compatible with Answering Machines and Caller ID",FREE Shipping,FREE Returns,In Stock.,True,N/A,$6.99
"Phone Holder for Car, Adjustable Automobile Cup Holder Phone Mount for iPhone Xs XS Max XR X 8 8+ 7 7 Plus 6s Plus 6s SE Samsung Galaxy S10 S10E S9 S9+ S8 S7 Edge S6 Note 5, Xperia, iPod, Smartphone",$19.99,https://www.amazon.com/gp/slredirect/picassoRedirect.html/ref=pa_sp_atf_next_aps_sr_pg3_1?ie=UTF8&adId=A02307701SZTRAAN0YWVK&url=%2FHolder-Adjustable-Automobile-Samsung-Smartphone%2Fdp%2FB07WQWHMNW%2Fref%3Dsr_1_33_sspa%3Fkeywords%3Dphone%26qid%3D1583976873%26sr%3D8-33-spons%26psc%3D1&qualifier=1583976873&id=808691355225441&widgetName=sp_atf_next,4.3,603,True,WBGD,N/A,N/A,"An adjustable base on the cell phone cup holder for a perfect fit in cars, trucks and other vehicles with standard-sized cup holders 
 One button device release to easily attach and detach your mobile device 
 Adjustable ball joint allows 360°rotation for optimal viewing angles of your device. Provide you with a comfortable and safe driving experience. The quick release button and adjustable clamp arms design make it very easy to insert and remove your phone with a single hand. Provide you with safer driving whether you are talking, navigating, listening to music or charging. 
 WBGD car phone holder offers you Free Replacement or Refund within 360 days for any conditions, lifetime timely customer service. Any problems pls feel free to let us know.","Fast, Free Shipping",FREE Returns,In Stock.,False,N/A,N/A
Cisco 7960G IP Telephone (CP-7960G) by Cisco,$99.95,https://www.amazon.com/gp/slredirect/picassoRedirect.html/ref=pa_sp_atf_next_aps_sr_pg3_2?ie=UTF8&adId=A0046221ECVLD5EY4S7M&url=%2FCisco-7960G-IP-Telephone-CP-7960G%2Fdp%2FB00VU65OJU%2Fref%3Dsr_1_34_sspa%3Fkeywords%3Dphone%26qid%3D1583976873%26sr%3D8-34-spons%26psc%3D1&qualifier=1583976873&id=808691355225441&widgetName=sp_atf_next,1.0,1,False,INGRAM CPO CISCO,N/A,N/A,N/A,N/A,N/A,In Stock.,True,N/A,$14.99
"AT&T CL4940 Corded Standard Phone with Answering System and Backlit Display, White",$32.27,https://www.amazon.com/AT-Standard-Answering-Backlit-Display/dp/B007B5VH0E/ref=sr_1_35?keywords=phone&qid=1583976873&sr=8-35,4.2,3454,True,AT&T,N/A,N/A,"Simple, Corded Operation . Line Power Mode . Display Dial . Mute . Last Number Redial . Flash 
 Receiver Volume Control . Ringer Volume Control . Table and Wall Mountable . Hearing Aid Compatible . English/Spanish/French Setup Menu 
 Clear speak Dial-in-Base Speakerphone . Speakerphone Volume Control . Caller ID / Call Waiting . 50 Name and Number Caller ID History 
 Digital Answering System . Call Screen/Intercept . Time and Date Stamp . Message Counter . Big button Display;Message guardR memory for power failure 
 Backlit Display . Extra-Large Tilt Display . Extra-Large Buttons.Power adapter input:AC120V 60Hz 
 DSL Subscribers may need to us a DSL Filter",FREE Shipping,FREE Returns,In Stock.,True,N/A,$6.99
"Power Gear Telephone Shoulder Rest, Hands Free Phone Conversations, Designed for Comfort, Strong Adhesive, Ergonomic Design, Black, 27636",$8.99,https://www.amazon.com/Power-Gear-Phone-Shoulder-27636/dp/B07FCBHK9Y/ref=sr_1_36?keywords=phone&qid=1583976873&sr=8-36,4.2,569,True,N/A,N/A,1 pk / 2 pk / 4 pk / 3 pk / 6 pk / 12 Feet / 25 Feet / Detangler / Shoulder Rest / Black / White,"READY TO USE – allows comfortable, hands-free phone calls and is ready to use out of the packaging. 
 FIRM HOLD - strong adhesive backing creates a long-lasting application to hold the shoulder rest in place 
 COMPATIBILITY – For home or office use with a wide variety of telephone styles 
 BLACK FINISH - sleek, black finish complements phones and accessories 
 SATISFACTION GUARANTEED – This product is backed by free, U.S.-based technical support. Call our team of professionals for free U. S. -Based technical support with any questions or issues about your purchase. Call the experts at 800-654-8483","Fast, Free Shipping",FREE Returns,In Stock.,False,N/A,N/A
"AT&T 4 handset Cordless Phone with answering System, Call Block, HD Audio, Bluetooth Connect to Cell, and Expandable up to 12 Phones",$59.97,https://www.amazon.com/AT-Cordless-Telephone-Answering-Handsets/dp/B07C7RQVBH/ref=sr_1_37?keywords=phone&qid=1583976873&sr=8-37,4.2,560,True,N/A,N/A,CL82414 / TL96456,"Connect to your Cell Phone 
 4 Cordless Handsets 
 Caller ID Announce 
 Push to Talk- Doubles as Multiple System Walkie Talkie 
 Digital Aswering System",FREE Shipping,FREE Returns,In Stock.,True,N/A,$9.99
"BLU Studio View 2019-6.0” GSM Unlocked Smartphone, 32GB+1GB RAM -Black",$64.99,https://www.amazon.com/BLU-Studio-2019-6-0-Unlocked-Smartphone/dp/B081FGL5XX/ref=sr_1_38?keywords=phone&qid=1583976873&sr=8-38,3.6,116,True,BLU,N/A,N/A,"8MP Main Camera with LED Flash + 8MP Selfie Camera with LED Flash 
 32GB Internal Memory 1GB RAM Micro SD up to 64GB; Quad Core 1.3GHz processor with Mali-400 
 Fingerprint Sensor, and Android 8.1 Oreo (Go Edition) 
 3G: (850/900/1900/2100): US compatibility Nationwide on all GSM Networks including AT&T, T-Mobile, Cricket, Metro PCS, and others. Not compatible with CDMA Networks like Verizon, Sprint and Boost Mobile)",FREE Shipping,FREE Returns,In Stock.,True,$9.99,N/A
"AT&T CL84107 DECT 6.0 Expandable Corded/Cordless Phone with Smart Call Blocker, Black/Silver with 1 Handset",$59.21,https://www.amazon.com/AT-CL84107-Expandable-Cordless-Blocker/dp/B07D2BHBYR/ref=sr_1_39?keywords=phone&qid=1583976873&sr=8-39,4.3,377,True,AT&T, $69.95,N/A,"1 cordless and 1 corded Handset, expandable up to 12 handsets 
 Digital Answering system with voice guide records up to 22 minutes 
 50 Name and number Caller ID history 
 High-contrast Backlit LCD and lighted keypad 
 Compatible with AT&T cordless accessory speakerphone and AT&T cordless headset 
 Experience the best in long-range coverage and clarity, provided by a unique antenna design and advances in noise-filtering technology.",FREE Shipping,FREE Returns,In Stock.,True,N/A,$9.99
Vtech Expandable Cordless Phone with Caller ID,$19.95,https://www.amazon.com/VTech-CS6719-15-Cordless-Waiting-Handset/dp/B00LNLLC0W/ref=sr_1_40?keywords=phone&qid=1583976873&sr=8-40,4.2,635,True,VTech,N/A,1 Handset / With Answering,"Know who's calling with caller ID/call waiting. Handset displays the name, number, time and date of incoming calls. 
 Enjoy a speakerphone that can keep up with your calls. Increase participation by allowing both ends to speak—and be heard—at the same time for conversations that are more true to life. 
 The entire keypad illuminates along with the LCD screen, allowing for easier viewing in dim light. 
 Power-conserving technology manages consumption for optimal battery performance. 
 This unit uses the CS6709 accessory handset (sold separately).","Fast, Free Shipping",FREE Returns,In Stock.,False,N/A,N/A
"AT&T DECT 6.0 Expandable Cordless Phone with Answering System, Silver/Black with 4 Handsets",$79.88,https://www.amazon.com/AT-CL82407-Expandable-Cordless-Answering/dp/B0735QBGCL/ref=sr_1_41?keywords=phone&qid=1583976873&sr=8-41,4.3,3378,True,AT&T, $99.95,Silver/Black / Rose Gold / Digital Answering System with 2 Handsets / Digital Answering System with 3 Handsets / Digital Answering System with 4 Handsets / Expansion Handset Only / Digital Answering System with 5 Handsets,"Digital Answering system with voice guide records up to 22 minutes 
 HD audio with Equalizer for customized audio 
 Backlit keypad and high-contrast LCD 
 Caller ID records past 50 names and numbers. 
 Smart call Blocker saves up to 1, 000 names and numbers. Voicemail waiting indicator. Message retrieval from Handset 
 50 Name and number phonebook Directory 
 Unsurpassed range coverage and clarity",FREE Shipping,FREE Returns,In Stock.,True,N/A,$9.99
VTech CS6719 Cordless Phone with Caller ID/Call Waiting,$19.91,https://www.amazon.com/VTech-CS6719-Cordless-Caller-Waiting/dp/B00GMQ5DO4/ref=sr_1_42?keywords=phone&qid=1583976873&sr=8-42,4.1,1362,False,VTech,N/A,Red / Silver,"Know who's calling with Caller ID/Call Waiting. Handset displays the name, number, time and date of incoming calls. 
 Enjoy a speakerphone that can keep up with your calls. Increase participation by allowing both ends to speak and be heard at the same time for conversations that are more true to life. 
 The entire keypad illuminates along with the LCD screen, allowing for easier viewing in dim light. 
 Power-conserving technology manages consumption for optimal battery performance. 
 Expandable up to 5 handsets with only one phone jack accessory handsets (sold separately). Additional handsets can be placed anywhere in your home or office near an outlet, no phone jack necessary. Convenient, flexible and easy to use.","Fast, Free Shipping",FREE Returns,"In stock on March 14, 2020.",False,N/A,N/A
Samsung Galaxy S20 5G Factory Unlocked New Android Cell Phone US Version | 128GB of Storage | Fingerprint ID and Facial Recognition | Long-Lasting Battery | US Warranty | Cloud Pink,$999.99,https://www.amazon.com/gp/slredirect/picassoRedirect.html/ref=pa_sp_mtf_aps_sr_pg3_1?ie=UTF8&adId=A02624101O0LQDM0YEYHP&url=%2FSamsung-Unlocked-Fingerprint-Recognition-Long-Lasting%2Fdp%2FB082XXQDJF%2Fref%3Dsr_1_43_sspa%3Fkeywords%3Dphone%26qid%3D1583976873%26sr%3D8-43-spons%26psc%3D1&qualifier=1583976873&id=808691355225441&widgetName=sp_mtf,3.1,16,False,Samsung,N/A,S20 5G / S20 5G w/ Free Galaxy Buds and DUO Pad / S20 Ultra / S20 Ultra w/ Free Galaxy Buds and DUO Pad / S20+ / S20+ w/ Free Galaxy Buds and DUO Pad / 128GB / 512GB / Cloud Blue / Cloud Pink / Cosmic Gray / Cosmic Black,"Power of 5G: Get next-level power for everything you love to do with Samsung Galaxy 5G; Share more, game harder, experience more and never miss a beat 
 Single Take AI: Capture video and multiple types of images with one tap of the shutter button; Lenses, effects and filters capture the best of every moment, every time 
 Hi-Res Camera Zoom: Capture hi-res images as if you’re 3 feet away, from 100 feet away; Whether you want to zoom in close from afar or magnify details nearby, the new 30x Space Zoom gives you impressive power and clarity 
 Bright Night Mode: Capture crisp images and vibrant video in Bright Night mode and create high-quality content in low light – no flash needed 
 Super Fast Charging: Charge up quicker with Super Fast Charge so you can keep moving with more juice; Give your buds – or Galaxy buds – a boost of power with Wireless PowerShare right from Galaxy S20 5G 
 All-Day Battery: Galaxy S20 5G’s intelligent battery uses an algorithm to learn from how you live to optimize power and take you through a day or more of work and life without ever giving out on you 
 Massive Storage: Generous storage out of the box and expandable memory means you never have to delete what’s important to you; Memory card sold separately",FREE Shipping,FREE Returns,Usually ships within 2 to 4 weeks.,True,$94.99,N/A
"Mpow Car Phone Mount, Dashboard Car Phone Holder, Washable Strong Sticky Gel Pad with One-Touch Design Compatible iPhone 11 pro,11 pro max,X,XS,XR,8,7,6 Plus,Galaxy S7,8,9,10,Google Nexus, Black",$10.59,https://www.amazon.com/Mpow-Washable-Strong-One-Touch-Dashboard/dp/B06XC5DRS4/ref=sr_1_46?keywords=phone&qid=1583976873&sr=8-46,3.9,15867,True,Mpow,N/A,Black / Red,"Extendable Arm:Telescopic arm can extend from 4.6in to 6.6in and pivot up or down for optimal viewing height. Prevent from blocking your view while driving. 
 360°Rotations:Swivel ball head ensures 360° free rotations to your desired viewing angle. Quick to adjust for a safe and effortless drive. As summer approaches and days are getting hotter, please avoid direct exposure to the sun as this may affect the function of your car mount 
 Flexible Arm Lock: Simply press the button to adjust arm width that ranges from 1.6-3.5in (4-8.8cm). Our car mount holder is compatible with most smart phones up to 6 inches. 
 All-Around Protection:There are sponge cushions on the car phone mount for secure and wobble-free fit for your cell phone. Foldable holding feet allow hassle-free charging for your cellphone. Note: Please avoid the car mount if you use a pop grip. It cannot hold phones with your Pop Mount/Pop out stand/expanding stands.","Fast, Free Shipping",FREE Returns,In Stock.,False,N/A,N/A
"2020 Updated Universal Cell Phone Holder for Car, Hands-Free One Touch Automatic Clamp Phone Mount, Air Vent Cell Phone Mount for iPhone, Samsung, Google Pixel, Moto, Nokia, and More",$7.99,https://www.amazon.com/Updated-Universal-Hands-Free-Automatic-Vent-Cell/dp/B082KKN114/ref=sr_1_47?keywords=phone&qid=1583976873&sr=8-47,3.8,158,False,PURSUN, $18.99,N/A,"AUTOMATIC LOCK AND ONE-TOUCH RELEASE – Mount your phone with just one hand using the Newest Motion Detection Technology. The arms of the device will open and close automatically when it senses your phone 5 cm away. To release your phone, just tap the back sensor and the arms will open and close automatically. Make your driving so much more convenient and enjoyable! 
 ADJUSTABLE VIEW AND HANDS-FREE – The ball and socket joint in the fastening clamps gives you 360° rotation so that you can adjust your view to any desired horizontal or vertical angle in place while driving for GPS navigation or emergency call. Perfect for people who live in states where hands free driving is the law! 
 UNIVERSAL COMPATIBILITY – The Pursun Cell Phone Car Mount is suitable for all cell phones with a width of 2.0-3.5 inches. The arms have a great range for thinner phones even with a bulky case and the shiny gold design adds a nice accent to your car. It is a great road trip essential for your driving. 
 TRY RISK FREE TODAY! – All of our car holders are a great blend of innovation, design, and build quality. We are proud to offer you 30-DAY MONEY BACK and a 18-MONTH WARRANTY. Get a PURSUN Cell Phone Car Mount today and experience the difference that real quality makes!","Fast, Free Shipping",FREE Returns,In Stock.,False,N/A,N/A
"iOttie Easy One Touch Mini Air Vent Car Mount Holder Cradle for iPhone Xs Max R 8 Plus 7 Samsung Galaxy S10 E S9 S8 Plus Edge, Note 9 & Other Smartphone",$10.78,https://www.amazon.com/iOttie-Holder-Cradle-Samsung-Smartphone/dp/B017HME9DC/ref=sr_1_48?keywords=phone&qid=1583976873&sr=8-48,4.1,3534,False,N/A, $16.95,Air Vent / CD Slot,"Universal, fits all smartphones and their Cases (such as OtterBox, Incipio) from 2.3 to 3.5 inches wide 
 Cradle rotates at the swivel Ball 360 degree for optimal viewing angles 
 Spring loaded one click lock and release feature to provide a strong clamped hold to users vent blade while also minimizing vibrations to your device 
 Built in support guides located on the back on the mount that hold wires in place for organized charging","Fast, Free Shipping",FREE Returns,"In stock on March 14, 2020.",False,N/A,N/A
"AT&T ML17929 2-Line Corded Telephone, Black",$47.99,https://www.amazon.com/AT-ML17929-2-Line-Corded-Telephone/dp/B007P8DKZ2/ref=sr_1_49?keywords=phone&qid=1583976873&sr=8-49,3.9,1663,True,N/A, $59.95,With Answering System / Without Answering System,"18 Number Speed Dial, 100 Name/Number Phonebook Directory 
 Speakerphone;It is portable 
 99 Name/Number Caller ID History 
 DSL Subscribers may need to us a DSL Filter. Please refer the User Manual & the Quick Start Guide before use. 
 Built-in speakerphone lets you multitask as you talk. 
 2-line operation offers flexibility for your home or business 
 3-party conferencing for quick remote meetings 
 18-number speed dial for your most frequently dialed or emergency numbers, DSL Subscribers may need to use a DSL Filter. Please refer the User Manual & the Quick Start Guide before use. 
 100 name/number phonebook keeps your contacts handy, Includes selectable ringer tones for each line .",FREE Shipping,FREE Returns,In Stock.,True,N/A,$8.99
"Car Cup Holder Phone Mount, Adjustable Gooseneck Cupholder Cell Phone Cradle with 360° Rotatable Holder for iPhone XR Xs XS Max X 8 7 7 Plus 6s/ Samsung Galaxy S10 S9 S8 S7/ Note 9 8, Huawei, GPS etc",$13.59,https://www.amazon.com/Adjustable-Gooseneck-Cupholder-Rotatable-Samsung/dp/B07WN1ZCNY/ref=sr_1_50?keywords=phone&qid=1583976873&sr=8-50,4.3,1514,True,Outsolidep,N/A,N/A,"Universal & Adjustable Cell Phone Holder - Extended from 2.1in to 3.74inch, simply press the right side release button of phone mount to open the clamp and press holder arms on both side to adjust width. The curved arm and 2 holding feet will provide your phone a entire protection, soft padded interior can protect your device from scratch while in the mount. Compatible with iPhone XR Xs X 8 8+ 7 7 Plus 6s Plus 6s SE/ Samsung Galaxy S10 S10E S9 S9+ S8 S7 / Note 9 8, Huawei, GPS etc. 
 Expandable and Durable Base - Easy tightening & loosening mechanism, this car phone mount will securely lock in your cup holder and you just need to rotate the cone shaped part to adjust the base size. Suitable for most automobiles, trucks and other vehicles with cupholder size between 2.56"" and 3.94"" (6.5~10cm) in diameter. NOTE: Please carefully compare the size of your car cup holder before purchase, ensure that this product can be placed in the car cup holder. 
 360 Degree Rotation - The fully 360-degree rotation holder allows you to position your phone or GPS device horizontally, vertically, or tilt in any direction by cooperating with the swivel ball head, providing you with the perfect angle to view your devices at a quick glance. Equipped with a flexible goose neck, makes the car phone mount easier and flexible to operate and access your mobile phone, allows you to set the height you like, adjust the best viewing angle while driving. 
 Easy to Operate - Designed with one-button released function, the width of phone holder can be flexibly adjusted in seconds, single-handed operation, no tools needed. The open bottom tray design of phone mount allows you to charge your phone with cables during use. What You Get: 1x 8.26in Car Cup Holder Phone Mount ; 1x Universal Phone Clamp.","Fast, Free Shipping",FREE Returns,In Stock.,False,N/A,N/A
"Andobil Car Phone Mount Easy Clamp, Ultimate Hands-Free Phone Holder for Car Dashboard Air Vent Windshield, Super Suction Compatible for iPhone 11/11 Pro/8 Plus/8/X/XR/XS/7 Plus Samsung S20/S10/S9/S8",$15.19,https://www.amazon.com/andobil-Dashboard-Windshield-Washable-Compatible/dp/B07FY84Y8Y/ref=sr_1_51?keywords=phone&qid=1583976873&sr=8-51,4.5,1849,True,andobil,N/A,Black / Matte Black,"▶EASY ONE-TOUCH OPERATION: Just a simple touch to mount or remove your phone within seconds - Super easy to use while you drive. It also features an adjustable foot, making this car mount universal for any cell phones up to 6.5”. Compatible with iPhone/ Samsung Galaxy/ LG/ Pixel, etc. 
 ▶EXTREME FLEXIBILITY: Thanks to the 360-degree swivel head, your phone can be oriented to portrait, landscape, or any angle in between. For added convenience, it has an extendable long arm to keep your phone always in view - And ready for hands free calls, GPS navigation & music streaming. 
 ▶BETTER DESIGN THAN EVER: Andobil phone holder for car is made with the most superior ABS plastic and anti-scratch cushion, which ensures full protection of your beloved phone. Moreover, the sturdy arm and stable ball joint can increase its durability. You’ll never again worry about a fallen phone. 
 ▶WHAT YOU GET: 100% satisfaction with 1-year hassle-free warranty and lifetime support. Andobil car phone mount *1, improved suction cup *1, upgraded air vent clip *1, extra dashboard pad *1, user manual *1. (Please note, the dashboard pad is for one-time use. Please think twice about the location.)","Fast, Free Shipping",FREE Returns,In Stock.,False,N/A,N/A
"Phone Holder Bed Gooseneck Mount - Lamicall Flexible Arm 360 Mount Clip Bracket Clamp Stand for Cell Phone 11 Pro XS Max XR X 8 7 6 Plus 5 4, Samsung S10 S9 S8 S7 S6, Overall Length 33.4In(Black)",$15.99,https://www.amazon.com/Phone-Holder-Bed-Gooseneck-Mount/dp/B07PLF1KMB/ref=sr_1_52?keywords=phone&qid=1583976873&sr=8-52,4.6,2207,True,Lamicall,N/A,Black / White,"【Flexible clip phone holder】 with 360 rotation clip on holder, flexible long gooseneck arm, You can freely adjust it to your best viewing angle when you’re lying on your bed or sofa. Notice: due to its flexible structure, there are wobbles while typing on the phone. 
 【Easy position】 distinctive dual-arm design, The thicker lower arm is to keep stability and the thinner upper arm is for easy twist. Flexible enough to twist yet durable enough to withstand repeatedly bend. 
 【Various using occasions】cell phone clip holder, with rubber padded clamp open maximum to 2. 75 inch, can be securely mounted to bed frame, nightstand, desk, free your hands, provide you with maximum comfort. 
 【Warm tips】this phone holder for desk is only suitable for reading and viewing.If you need to Type on your phone, please take it off.And please use two hands to adjust the view of the arm to promise a long time life for this gooseneck phone holder.","Fast, Free Shipping",FREE Returns,In Stock.,False,N/A,N/A
"ZIZO Transform Wiko Ride Case | Dual-Layer Protection w/Kickstand, Military Grade Drop Protection Designed for Wiko Ride (Black/Black)",$12.99,https://www.amazon.com/gp/slredirect/picassoRedirect.html/ref=pa_sp_btf_aps_sr_pg3_1?ie=UTF8&adId=A04525872HJ4DUVLIP1QG&url=%2FTransform-Dual-Layer-Protection-Kickstand-Military%2Fdp%2FB07XF41JXT%2Fref%3Dsr_1_53_sspa%3Fkeywords%3Dphone%26qid%3D1583976873%26sr%3D8-53-spons%26psc%3D1&qualifier=1583976873&id=808691355225441&widgetName=sp_btf,4.5,25,False,Zizo,N/A,Black/Black / Blue/Black,"A lightweight, heavy-duty case that will protect your phone from bumps, drops, and shocks. 
 Zizo is a Family company that has over a decade of experience in making quality phone cases. 
 Each aspect is carefully designed, checked, and tested to ensure quality and consistency of the product. 
 Wiko Ride Case Compatible with Wiko Ride.",N/A,N/A,In Stock.,False,N/A,N/A
