Name,Price,Link,Customer Review,Review Count,Seller,Specs List(If Applicable),Item Description,Shipping Option,Returning Option,Item Stock Level
"CUK MSI GF65 Thin Gaming Laptop (Intel i7-9750H, 16GB RAM, 512GB NVMe SSD, NVIDIA GeForce RTX 2060 6GB, 15.6"" FHD 120Hz IPS-Level, Windows 10 Home) Gamer Notebook Computer","$1,123.99",https://www.amazon.com/gp/slredirect/picassoRedirect.html/ref=pa_sp_atf_aps_sr_pg1_1?ie=UTF8&adId=A025971635N2Q848K4WMC&url=%2FGF65-i7-9750H-IPS-Level-Notebook-Computer%2Fdp%2FB07YLW2Y3G%2Fref%3Dsr_1_1_sspa%3Fkeywords%3Dgaming%2Blaptop%26qid%3D1583954768%26sr%3D8-1-spons%26psc%3D1&qualifier=1583954768&id=5700902331305372&widgetName=sp_atf,4.5,35,N/A,16GB RAM | 512GB NVMe SSD / 32GB RAM | 1TB NVMe SSD / 32GB RAM | 2TB NVMe SSD / 32GB RAM | 512GB NVMe SSD / 64GB RAM | 1TB NVMe SSD / 64GB RAM | 2TB NVMe SSD,"Processor: Intel Core i7-9750H Six Core Processor (12MB Cache, 2.6GHz-4.5GHz) 45W 
 RAM: 16GB DDR4 2666MHz | Hard Drive: 512GB NVMe Solid State Drive 
 Keyboard: Single Backlight with Anti-Ghost Key + Silver Lining | Operating System: Windows 10 Home x64 
 Graphics: NVIDIA GeForce RTX 2060 6GB GDDR6 | Display: 15.6"" Full HD 120Hz IPS-Level Thin Bezel Display (1920 x 1080) 
 16GB RAM Upgrade | 3-Year CUK Limited Warranty (View warranty section below for more details.)",FREE Shipping,FREE Returns,Only 11 left in stock - order soon.
"Asus ROG Strix Scar III (2019) Gaming Laptop, 15.6” 240Hz IPS Type FHD, NVIDIA GeForce RTX 2060, Intel Core i7-9750H, 16GB DDR4, 1TB PCIe Nvme SSD, Per-Key RGB KB, Windows 10, G531GV-DB76","$1,699.99",https://www.amazon.com/gp/slredirect/picassoRedirect.html/ref=pa_sp_atf_aps_sr_pg1_2?ie=UTF8&adId=A0544911XI2CT87F652P&url=%2FGaming-GeForce-i7-9750H-Windows-G531GV-DB76%2Fdp%2FB07S3L9LPT%2Fref%3Dsr_1_2_sspa%3Fkeywords%3Dgaming%2Blaptop%26qid%3D1583954768%26sr%3D8-2-spons%26psc%3D1&qualifier=1583954768&id=5700902331305372&widgetName=sp_atf,4.4,127,ASUS,144Hz | 512GB SSD | RTX 2070 / 240Hz | 1TB SSD | RTX 2060 / 240Hz | 1TB SSD | RTX 2070,"Nvidia GeForce RTX 2060 6GB GDDR6 (base: 1110MHz, Boost: 1335MHz, TDP: 80W) 
 Latest 9th Gen Intel Core i7-9750h Processor.Bluetooth 5.0 
 240Hz 15.6” Full HD 1920x1080 IPS Type Display 
 16GB DDR4 2666MHz RAM | 1TB PCIe SSD | Windows 10 Home | Gigabit wave 2 Wi-Fi 5 (802.11AC 2x2) 
 Rog intelligent cooling Thermal system with dual 12V fans, anti-dust technology, and adjustable fan modes",FREE Shipping,FREE Returns,In Stock.
"Asus TUF FX505DT Gaming Laptop, 15.6” 120Hz Full HD, AMD Ryzen 5 R5-3550H Processor, GeForce GTX 1650 Graphics, 8GB DDR4, 256GB PCIe SSD, Gigabit Wi-Fi 5, Windows 10 Home, FX505DT-AH51, RGB Keyboard",$649.99,https://www.amazon.com/R5-3550H-Processor-Graphics-FX505DT-AH51-Keyboard/dp/B07VBK4SYS/ref=sr_1_3?keywords=gaming+laptop&qid=1583954768&sr=8-3,4.3,963,N/A,Metallic | Core i7 | 512G | GTX 1650 / Metallic | Ryzen 7 | 256 + 1 | GTX 1660Ti / Ryzen 5 | 256G | GTX 1650 / Ryzen 7 | 512G | RTX 2060,"Nvidia GeForce GTX 1650 4GB graphics (base: 1395MHz, Boost: 1560MHz, TDP: 50W) 
 Quad-core AMD Ryzen 5 r5-3550h processor 
 15.6” 120Hz full HD (1920x1080) IPS-type display 
 256GB NVMe SSD | 8GB DDR4 RAM | Windows 10 Home 
 Gigabit wave 2 Wi-Fi 5 (802.11AC) 
 Durable gaming laptop with MIL-STD-810 military standard construction 
 Dual fans with anti-dust technology | RGB backlit Keyboard rated for 20-million keystroke durability",FREE Shipping,FREE Returns,In Stock.
"Acer Predator Helios 300 Gaming Laptop PC, 15.6"" Full HD 144Hz 3ms IPS Display, Intel i7-9750H, GeForce GTX 1660 Ti 6GB, 16GB DDR4, 256GB NVMe SSD, Backlit Keyboard, PH315-52-78VL","$1,099.99",https://www.amazon.com/Acer-Predator-i7-9750H-Keyboard-PH315-52-78VL/dp/B07QXLFLXT/ref=sr_1_4?keywords=gaming+laptop&qid=1583954768&sr=8-4,4.5,1695,N/A,i5-9300H/GTX 1660Ti/8GB/512GB / i7-9750H/GTX 1660Ti/16GB/256GB / i7-9750H/GTX 1660Ti/16GB/512GB / i7-9750H/RTX 2060/16GB/512GB / Notebook only / Notebook with headset / Notebook with mousepad,"9th Generation Intel Core i7 9750H 6 Core Processor (Up to 4.5GHz) with Windows 10 Home 64 Bit 
 NVIDIA GeForce GTX 1660 Ti Graphics with 6GB of dedicated GDDR6 VRAM 
 15.6 inches Full HD (1920 x 1080) Widescreen LED backlit IPS Display (144Hz Refresh Rate, 3ms Overdrive Response Time, 300nit Brightness and 72 percentage NTSC) 
 16GB DDR4 2666MHz Memory, 256GB PCIe NVMe SSD (2 x PCIe M.2 Slots; 1 Slot Open for Easy Upgrades) and 1 Available Hard Drive Bay 
 Backlit Keyboard; LAN: Killer Ethernet E2500 10/100/1000 Gigabit Ethernet LAN; Wireless: Killer DoubleShot Pro Wireless AC 1550 802. 11ac; 4th Gen All Metal AeroBlade 3D Fan",FREE Shipping,FREE Returns,In Stock.
"Acer Aspire 5 Slim Laptop, 15.6 inches Full HD IPS Display, AMD Ryzen 3 3200U, Vega 3 Graphics, 4GB DDR4, 128GB SSD, Backlit Keyboard, Windows 10 in S Mode, A515-43-R19L,Black",$313.41,https://www.amazon.com/Acer-Display-Graphics-Keyboard-A515-43-R19L/dp/B07RF1XD36/ref=sr_1_5?keywords=gaming+laptop&qid=1583954768&sr=8-5,4.5,4042,Acer,AMD Ryzen 3 3200u / AMD Ryzen 5 3500u / AMD Ryzen 7 3700u / Notebook⠀with⠀backpack / Notebook⠀with⠀mouse / Notebook⠀Only,"AMD Ryzen 3 3200U Dual Core Processor (Up to 3.5GHz); 4GB DDR4 Memory; 128GB PCIe NVMe SSD 
 15.6 inches Full HD (1920 x 1080) Widescreen LED backlit IPS Display; AMD Radeon Vega 3 Mobile Graphics 
 1 USB 3.1 Gen 1 Port, 2 USB 2.0 Ports & 1 HDMI Port with HDCP support 
 802.11ac Wi-Fi; Backlit Keyboard; Up to 7.5 Hours Battery Life 
 Windows 10 in S mode. Maximum Power Supply Wattage 65 W",FREE Shipping,FREE Returns,In Stock.
"Newest HP Pavilion 15.6"" FHD IPS Premium Gaming Laptop, AMD 2nd Gen Quad-Core Ryzen 5 3550H, 8GB RAM, 256GB SSD, NVIDIA GeForce GTX 1050 3GB GDDR5, Backlit Keyboard, Windows 10",$619.00,https://www.amazon.com/HP-Pavilion-Premium-Quad-Core-Keyboard/dp/B0814QQW56/ref=sr_1_6?keywords=gaming+laptop&qid=1583954768&sr=8-6,4.4,50,N/A,N/A,"AMD 2nd Generation Ryzen 5 3550H Processor (Quad-core, 2.1 GHz Up To 3.7 GHz, 4 MB Cache), 8GB DDR4 Memory, 256GB SSD 
 15.6"" Full HD (1920 x 1080) IPS Widescreen LED-backlit Display, NVIDIA GeForce GTX 1050 3GB GDDR5 
 10/100/1000Mbps Ethernet, 802_11_AC, Bluetooth 4.1, Card Reader, HD Audio with Stereo Speakers, Webcam 
 1 x USB 3.1 Type-C, 1 x USB 3.1 Type-A, 1 x USB 2.0, 1 x Headphone/Speaker/Line-Out Jack, 1 x RJ-45 
 Full-size Island-style Backlit Keyboard with Numeric Keypad, Windows 10 Home 64-bit, 52.5WHr 3-cell lithium_ion, 4.96lb, Black",N/A,N/A,In Stock.
"Omen by HP 2019 17-Inch Gaming Laptop, Intel i7-9750H Processor, NVIDIA RTX 2080 8 GB, 16 GB RAM, 256 GB SSD & 1 TB HDD, VR Ready, Windows 10 Home (17-cb0050nr, Black)","$1,949.99",https://www.amazon.com/HP-17-Inch-i7-9750H-Processor-17-cb0050nr/dp/B07T443QPD/ref=sr_1_7?keywords=gaming+laptop&qid=1583954768&sr=8-7,4.2,57,HP,17-cb0030nr / 17-cb0050nr,"Desktop-grade power in a portable laptop with hyper-realistic Graphics: NVIDIA GeForce RTX 2080 (8 GB GDDR6 dedicated). enjoy new levels of gaming realism, speed, power efficiency and immersion with real-time ray-tracing technologies. Vr/mr ready. 17.3-Inch diagonal FHD IPS Anti-Glare micro-edge WLED-backlit Display (1920 x 1080) with 144Hz refresh rate 
 Cutting-edge gaming performance: play The latest games, including Fortnight, PUBG, and Overwatch, from anywhere—without sacrificing performance 
 Omen command center: easily turn up your performance with included software that enables control over your CPU overclocking settings and prioritizes your gaming traffic to minimize latency 
 Super Fast Processor: 9th Generation intel(r) core(tm) i7-9750h Processor, 6-Core, 2.6GHz up to 4.5GHz for superior gaming performance 
 Memory and storage: 16 GB DDR4-2666 SDRAM (upgradable with 2 accessible Memory Slots) plus the storage capacity and snappy responsiveness of a dual storage solution with 256 GB pcie(r) nvme(tm) M.2 SSD, and 1 TB 7200 RPM SATA HDD 
 Bios recovery and protection: automatically checks the health of your PC, protects against unauthorized access, secures local storage and recovers itself from boot-up issues 
 Ports: headphone/Microphone combo, Microphone jack, 3 USB 3.1 Type-A, 1 RJ-45, 1 HDMI, 1 Mini displayport(tm), 1 USB 3.1 Type-C(tm), 1 media card Reader 
 Dimensions AND weight (unpackaged): 15.94 inches (W) x 11.22 inches (D) x 0.80 inch (H); 7.26 pounds 
 Operating System and Warranty: Windows 10 Home and 1-Year Limited hardware warranty with 24-hour, 7 days a week Web support when shipped from and sold by Amazon.Com and not a third party seller",FREE Shipping,FREE Returns,Only 14 left in stock (more on the way).
"Sager NP7856 15.6 Inches Thin Bezel FHD IPS 144Hz Gaming Laptop, Intel Core i7-9750H, RTX 2060 6GB DDR6, 16GB RAM, 500GB NVMe SSD, Windows 10 Home","$1,299.00",https://www.amazon.com/Sager-NP7856-Inches-i7-9750H-Windows/dp/B07S2GRTKZ/ref=sr_1_8?keywords=gaming+laptop&qid=1583954768&sr=8-8,4.6,38,Sager,144Hz | 16GB RAM + 1TB NVMe SSD / 144Hz | 16GB RAM + 500GB NVMe SSD / 144Hz | 16GB RAM + 500GB NVMe SSD + 1TB HDD / 144Hz | 16GB RAM + 500GB NVMe SSD + 2TB SSHD / 144Hz | 32GB RAM + 1TB NVMe SSD / 144Hz | 32GB RAM + 500GB NVMe SSD + 1TB HDD / 144Hz | 32GB RAM + 500GB NVMe SSD + 2TB SSHD,"Display: 15.6” Thin Bezel Full HD 144Hz 5ms, IPS, 72% NTSC (1920x 1080) Matte Display 
 Processor: 9th Gen Intel Core i7-9750H 6-Core Processor | Operating System: Windows 10 Home 
 Graphic Card: NVIDIA GeForce RTX 2060 6GB GDDR6 
 Ram: 16GB DDR4 2666MHz | Storage: 500GB PCIe NVMe SSD 
 Single Zone Multi-Color illuminated keyboard, Intel Dual Band Wireless-AC 9560 + Bluetooth",FREE Shipping,FREE Returns,Only 7 left in stock - order soon.
"HP Pavilion 15.6"" FHD Gaming Laptop AMD Ryzen 5-3550H, 16GB DDR4 RAM, 256GB SSD+1TB HDD, NVIDIA GTX 1050, Quad-Core up to 3.70 GHz, 1920x1080, Backlit, RJ-45 LAN, Bluetooth 5.0, USB-C, Win 10",$701.45,https://www.amazon.com/HP-Pavilion-Quad-Core-1920x1080-Bluetooth/dp/B08129Z8C2/ref=sr_1_9?keywords=gaming+laptop&qid=1583954768&sr=8-9,4.4,38,HP,N/A,"AMD Ryzen 5 3550H with Radeon Vega 8 Graphics (2.1 GHz base clock, up to 3.7 GHz max boost clock, 6 MB cache, 4 cores). NVIDIA GeForce GTX 1050 with 3GB dedicated graphics memory. Featuring innovative new architecture, they deliver elite, multi-threaded processing for gaming, streaming, creativity, VR and more. 
 15.6"" diagonal FHD SVA anti-glare micro-edge WLED-backlit (1920 x 1080). With the Pavilion’s anti-glare panel, outfitted with a non-reflective, low-gloss design for less glare, even in direct sunlight. Full HD resolution and a lightning-quick refresh rate deliver smooth gameplay and lifelike visuals. 
 1x USB 3.1 Gen 1 Type-C, 1x USB 3.1 Type-A, 1x USB 2.0 Type-A, 1x RJ-45, 1x HDMI 2.0, 1x headphone/microphone combo jack. Multi-format SD media card reader. Realtek Wi-Fi 5 (2x2) and Bluetooth 5 combo. 
 10.12 x 14.17 x 0.93 in (257.05 x 359.92 x 23.62 mm). 4.96 lbs. (2.25 kgs). HP TrueVision HD camera. Bang & Olufsen audio with HP Dual Speakers and HP Audio Boost. The Pavilion’s wide rear corner vent and enlarged air inlets maximize airflow to optimize your overall performance and stability, keeping the machine cool during intense marathon sessions. 
 Achieve next-level gaming performance with the dauntingly daring HP Pavilion 15 Gaming Laptop. Combining top-notch NVIDIA graphics with mighty AMD processing power, it brings the muscle for gaming, creating, and multitasking, so you can do it all, anywhere.",N/A,N/A,Only 5 left in stock - order soon.
"MSI GF63 THIN 9RCX-818 15.6"" Gaming Laptop, Thin Bezel, Intel Core i7-9750H, NVIDIA GeForce GTX 1050 Ti, 8GB, 256GB NVMe SSD",$769.00,https://www.amazon.com/MSI-GF63-THIN-9RCX-818-i7-9750H/dp/B07XZ21HH7/ref=sr_1_10?keywords=gaming+laptop&qid=1583954768&sr=8-10,4.4,240,MSI,GTX1050ti|i5-9300H|8GB|512NVMe SSD / GTX1050ti|i7-9750H| 8GB |256NVMe SSD / GTX1650 |i5-9300H|8GB|512NVMe SSD,"Display: 15. 6"" Fhd (1920*1080), IPS-Level 60Hz 45%ntsc thin Bezel 1920x1080 16: 9 
 Graphics: NVIDIA GeForce GTX1050ti 4G GDDR5 
 Processor: Intel Core i7-9750h 2. 6 - 4. 5GHz 
 Memory: 8GB (8G*1) DDR4 2666MHz 2 Sockets; Max Memory 64GB 
 Storage: 256GB NVMe SSD",N/A,N/A,Only 3 left in stock - order soon.
"Acer Predator Helios 300 Gaming Laptop, Intel Core i5-9300H, GeForce GTX 1660 Ti, 15.6"" Full HD 120Hz Display, 3ms Response Time, 8GB DDR4, 512GB PCIe NVMe SSD, Backlit Keyboard, PH315-52-588F,Black",$899.99,https://www.amazon.com/gp/slredirect/picassoRedirect.html/ref=pa_sp_mtf_aps_sr_pg1_1?ie=UTF8&adId=A1045996BG3EHKOK66GI&url=%2FAcer-Predator-i5-9300H-Response-PH315-52-588F%2Fdp%2FB07YM9ZB3N%2Fref%3Dsr_1_11_sspa%3Fkeywords%3Dgaming%2Blaptop%26qid%3D1583954768%26sr%3D8-11-spons%26psc%3D1&qualifier=1583954768&id=5700902331305372&widgetName=sp_mtf,4.5,1695,Acer,i5-9300H/GTX 1660Ti/8GB/512GB / i7-9750H/GTX 1660Ti/16GB/256GB / i7-9750H/GTX 1660Ti/16GB/512GB / i7-9750H/RTX 2060/16GB/512GB / Notebook only / Notebook with headset / Notebook with mousepad,"9th Generation Intel Core i5-9300H 4-Core Processor (Up to 4.1GHz) with Windows 10 Home 64 Bit 
 NVIDIA GeForce GTX 1660 Ti Graphics with 6 GB of dedicated GDDR6 VRAM 
 15.6"" Full HD (1920 x 1080) Widescreen LED-backlit IPS display (120Hz Refresh Rate, 3ms Overdrive Response Time, 300nit Brightness & 72% NTSC) 
 8GB DDR4 2666MHz Memory, 512GB PCIe NVMe SSD (2 x PCIe M.2 Slots | 1 Slot Open for Easy Upgrades) & 1 - Available Hard Drive Bay 
 Backlit Keyboard | LAN: Killer Gaming Network E2500 | Wireless: Killer DoubleShot Pro Wireless-AX 1650 WiFi 6 802.11ac | 4th Gen All-Metal AeroBlade 3D Fan",FREE Shipping,FREE Returns,Only 2 left in stock (more on the way).
"Lenovo Ideapad L340 Gaming Laptop, 15.6 Inch FHD (1920 X 1080) IPS Display, Intel Core i5-9300H Processor, 8GB DDR4 RAM, 512GB Nvme SSD, NVIDIA GeForce GTX 1650, Windows 10, 81LK00HDUS, Black",$721.98,https://www.amazon.com/gp/slredirect/picassoRedirect.html/ref=pa_sp_mtf_aps_sr_pg1_2?ie=UTF8&adId=A04377172E7Z4FCOM31IX&url=%2FLenovo-Ideapad-i5-9300H-Processor-81LK00HDUS%2Fdp%2FB07VC55LF5%2Fref%3Dsr_1_12_sspa%3Fkeywords%3Dgaming%2Blaptop%26qid%3D1583954768%26sr%3D8-12-spons%26psc%3D1&qualifier=1583954768&id=5700902331305372&widgetName=sp_mtf,4.4,396,N/A,"Laptop + Bag / Laptop + Mouse Pad, medium / Laptop + Mouse Pad, small / Single","A new dimension of gaming performance awaits - with 9th-generation Intel Core i5 processors, the IdeaPad L340 gaming has the power you need to outshoot, outrun, and outsmart anyone. Includes 8GB DDR4 RAM and 512GB NVMe SSD 
 Take it to the next level - with the latest NVIDIA GeForce Graphics behind you, you can tame the hottest titles with faster, smoother, and more power-efficient gameplay. Plus, the 15.6-Inch Screen delivers a stunning full HD IPS Display with 1920 x 1080 resolution 
 A portal to a new sound Dimension - hardwired into every IdeaPad L340 gaming is advanced Dolby Audio technology. Take your mobile gaming experience to another dimension and have a real blast along the way 
 Control your own Fate - GAME in 'quick' Mode or work in 'quiet' Mode. It's your call with a simple function setting that lets you shift gears between modes, instantly. 
 Final product may vary slightly from image",FREE Shipping,FREE Returns,In Stock.
"Acer Nitro 5 Gaming AN515 15.6-inch FHD(1920x1080) IPS Laptop PC, 8th Gen Intel i5-8300H (Up to 4.0GHz), NVIDIA GeForce GTX 1050 4GB GDDR5, 16GB DDR4, 1TB HDD, Backlit Keyboard, Bluetooth, Windows 10",$669.00,https://www.amazon.com/Acer-Nitro-AN515-16GB-1TB/dp/B07ZZKP45P/ref=sr_1_13?keywords=gaming+laptop&qid=1583954768&sr=8-13,4.8,9,N/A,N/A,"16GB DDR4 SDRAM Memory, 1TB 7200RPM SATA Hard Drive, NVIDIA GeForce GTX 1050 4 GB GDDR5 for superior gaming performance and multitasking, Wireless Mouse and Mouse Pad Included 
 Quad-Core 8th Generation Intel Core i5-8300H 2. 3GHz Processor (8M Cache, up to 4. 0 GHz), Backlit Keyboard 
 15. 6-inch Widescreen Full HD IPS (1920 x 1080) ComfyView Display, Stereo speakers with Acer TrueHarmony Plus technology, Dialogue Enhancer, Volume Maximizer, Bass Enhancer, Surround Virtualizer 
 802. 11ac WiFi, Bluetooth, 1 x HDMI, 2 x USB 2. 0 (Type-A), 1 x USB 3. 1 (Gen 1 Type-A), 1 x USB 3. 1 (Gen 1 Type-C), 1 x RJ-45, No optical Drive 
 Windows 10 Home 64-Bit Operating System, 4-Cell Lithium-Ion Battery, Up to 5. 5 Hrs Battery Life, Color: Shale Black",N/A,N/A,In Stock.
"2020 ASUS TUF 17.3"" FHD VR Ready Gaming Laptop Computer, AMD Ryzen 7 3750H Quad-Core (Beats i7-8565u), 32GB DDR4 RAM, 1TB PCIe SSD, NVIDIA GeForce GTX 1650 4GB, Windows 10 Home, YZAKKA Accessories","$1,079.00",https://www.amazon.com/ASUS-TUF-Computer-Quad-Core-Accessories/dp/B0857KFNBV/ref=sr_1_14?keywords=gaming+laptop&qid=1583954768&sr=8-14,4.3,8,ASUS,"8GB DDR4 RAM, 512GB PCIE SSD / 16GB DDR4 RAM, 512GB PCIe SSD / 24GB DDR4 RAM, 1TB PCIe SSD / 24GB DDR4 RAM, 2TB PCIe SSD / 32GB DDR4 RAM, 1TB PCIe SSD / 32GB DDR4 RAM, 2TB PCIe SSD","AMD Ryzen 7 3750H Quad-Core (2.3GHz base frequency, up to 4.0GHz burst frequency) APU is quick and versatile, with quad cores and eight threads capable of cutting through day-to-day work. 
 Beautiful 17.3"" IPS-Level Full HD Widescreen LED Display (1920 x 1080) Display boasts impressive color and clarity. NVIDIA GeForce GTX 1650 Graphics backed by 4GB GDDR5 dedicated video memory for an ultrafast, advanced GPU to fuel your games. 
 32GB DDR4 2400MHz Memory for full-power multitasking; 1TB PCIE SSD for faster performance and better reliability; Pci-e SSDs are great for major gaming applications, multiple servers, daily backups, and more, dual drives ensure faster performance and better reliability. 
 802.11 Wireless-AC + Bluetooth 4.2, 1 x USB 3.1, 1 x USB 2.0, 1 x HDMI 2.0 
 Windows 10 Home, 64-bit, English; Black, RGB backlit keyboard; YZAKKA USB extension cord 6ft, HDMI cable 6ft and Mouse Pad",N/A,N/A,Only 20 left in stock - order soon.
"Lenovo Ideapad L340 Gaming Laptop, 15.6 Inch FHD (1920 X 1080) IPS Display, Intel Core i5-9300H Processor, 8GB DDR4 RAM, 512GB Nvme SSD, NVIDIA GeForce GTX 1650, Windows 10, 81LK00HDUS, Black",$721.98,https://www.amazon.com/Lenovo-Ideapad-i5-9300H-Processor-81LK00HDUS/dp/B07VC55LF5/ref=sr_1_15?keywords=gaming+laptop&qid=1583954768&sr=8-15,4.4,396,Lenovo,"Laptop + Bag / Laptop + Mouse Pad, medium / Laptop + Mouse Pad, small / Single","A new dimension of gaming performance awaits - with 9th-generation Intel Core i5 processors, the IdeaPad L340 gaming has the power you need to outshoot, outrun, and outsmart anyone. Includes 8GB DDR4 RAM and 512GB NVMe SSD 
 Take it to the next level - with the latest NVIDIA GeForce Graphics behind you, you can tame the hottest titles with faster, smoother, and more power-efficient gameplay. Plus, the 15.6-Inch Screen delivers a stunning full HD IPS Display with 1920 x 1080 resolution 
 A portal to a new sound Dimension - hardwired into every IdeaPad L340 gaming is advanced Dolby Audio technology. Take your mobile gaming experience to another dimension and have a real blast along the way 
 Control your own Fate - GAME in 'quick' Mode or work in 'quiet' Mode. It's your call with a simple function setting that lets you shift gears between modes, instantly. 
 Final product may vary slightly from image",FREE Shipping,FREE Returns,In Stock.
"Omen by HP 2019 15-Inch Gaming Laptop, Intel i7-9750H Processor, GeForce RTX 2070 8 GB, 32 GB RAM, 512 GB SSD, VR Ready, Windows 10 Home (15-dc1047nr, Black)","$1,499.00",https://www.amazon.com/HP-15-Inch-i7-9750H-Processor-15-dc1047nr/dp/B07SRXV9LG/ref=sr_1_16?keywords=gaming+laptop&qid=1583954768&sr=8-16,3.9,52,N/A,N/A,"Hyper-realistic Graphics: NVIDIA GeForce RTX 2070 (8 GB GDDR5 dedicated). enjoy new levels of gaming realism and performance with real-time ray-tracing technologies. Vr/mr ready. 15.6-Inch diagonal FHD IPS Anti-Glare micro-edge WLED-backlit Display (1920 x 1080) with 144Hz refresh rate 
 Cutting-edge gaming performance: play The latest games, including Fortnight, PUBG, and Overwatch, from anywhere—without sacrificing performance 
 Omen command center: easily turn up your performance with included software that enables control over your CPU overclocking settings and prioritizes your gaming traffic to minimize latency 
 Super Fast Processor: 9th Generation intel(r) core(tm) i7-9750h Processor, 6-Core, 2.6GHz up to 4.5GHz for superior gaming performance 
 Memory and storage: 32 GB DDR4-2666 SDRAM (upgradable with 2 accessible Memory Slots) and Fast boot-up, file transfer and a snappier experience with the internal 512 GB pcie(r) nvme(tm) M.2 Solid State Drive 
 Bios recovery and protection: automatically checks the health of your PC, protects against unauthorized access, secures local storage and recovers itself from boot-up issues 
 Ports: headphone/Microphone combo, Microphone jack, 2 USB 3.1 Gen 1 (side), 1 RJ-45 (rear), 1 USB 3.1 Gen 1 (rear), 1 HDMI 2.0 (rear), 1 Mini displayport(tm) (rear), 1 USB 3.1 Type-C(tm) (rear), 1 media card Reader 
 Dimensions AND weight (unpackaged): 14.17 inches (W) x 10.35 inches (D) x 0.98 inch (H); 5.12 pounds 
 Operating System and Warranty: Windows 10 Home and 1-Year Limited hardware warranty with 24-hour, 7 days a week Web support",N/A,N/A,Only 1 left in stock - order soon.
"2019 ASUS ROG 15.6"" FHD Gaming Laptop Computer, Intel Hexa-Core i7-9750H Up to 4.5GHz, 16GB DDR4, 1TB HDD + 512GB SSD, NVIDIA GeForce GTX 1650, 802.11ac WiFi, HDMI, USB 3.0, Windows 10",$935.00,https://www.amazon.com/ASUS-ROG-Computer-Hexa-Core-i7-9750H/dp/B07SZ1J9TG/ref=sr_1_17?keywords=gaming+laptop&qid=1583954768&sr=8-17,4.3,114,ASUS,N/A,"▶ With the latest 9th Gen Intel Core i7-9750H mobile processor; (2. 60 GHz, Max Turbo Frequency 4. 50 GHz, 12 MB SmartCache); Powerful 6-core, twelve-way processing performance. 
 ▶ With a beautiful 15. 6"" Full HD display; the 1920 x 1080 resolution boasts impressive color and clarity. Energy-efficient LED backlight, With NVIDIA GeForce GTX 1650 graphics. Backed by 4GB GDDR5 dedicated video memory for a fast, advanced GPU to fuel your games. 
 ▶ 16GB 2666MHz DDR4 SDRAM Memory for full-power multitasking; 1TB HDD + 512GB Solid State Drive, While offering less storage space than a hard drive, a flash-based SSD has no moving parts, resulting in faster start-up times and data access, no noise, and reduced heat production and power draw on the battery. 
 ▶ Intel 802. 11ac (2x2) + Bluetooth, Backlit Keyboard, 3 x USB 3. 0, 1 x HDMI, NO Webcam, NO Optical Drive, 1 x headphone combo jack 
 ▶ Windows 10 home 64 bit, brings back the Start Menu from Windows 7 and introduces new features, like the Edge Web browser that lets you markup Web pages on your screen, Dimension: 1x14. 2x10. 8”; Product Weight: 5. 32 pounds",N/A,N/A,Only 5 left in stock - order soon.
"ASUS TUF Gaming Laptop, 17.3” Full HD IPS Type, AMD Ryzen 5 3550H CPU, AMD Radeon RX560X, 8GB DDR4, 512GB PCIe SSD, Gigabit Wi-Fi 5, Windows 10 Home - FX705DY-EH53",$729.99,https://www.amazon.com/ASUS-Gaming-Laptop-Gigabit-Windows/dp/B07YZ1CM55/ref=sr_1_18?keywords=gaming+laptop&qid=1583954768&sr=8-18,4.2,102,N/A,N/A,"Quad-core AMD Ryzen 5 3550H (2M Cache, up to 3. 7GHz) 
 AMD Radeon RX560X graphics 
 17. 3” FHD (1920x1080) IPS type display 
 512GB PCIe NVMe M. 2 SSD | 8GB DDR4 RAM | Windows 10 Home 
 Portable design with 1. 02” thin profile gaming laptop 
 Dual fans with anti-dust technology 
 Red-backlit keyboard rated for 20-million keystroke durability 
 7.2 millimeter narrow bezel for upto 79 % screen-to-body ratio 
 Durable MIL-STD-810 military standard construction",FREE Shipping,FREE Returns,In Stock.
"Omen by HP 2019 15-Inch Gaming Laptop, Intel i7-8750H Processor, NVIDIA RTX 2060 6 GB, 16 GB RAM, 128 GB SSD, 1 TB HDD, VR Ready, Windows 10 Home (15-dc1030nr, Black)","$1,199.00",https://www.amazon.com/HP-15-Inch-i7-8750H-Processor-15-dc1030nr/dp/B07NDYBX4G/ref=sr_1_19?keywords=gaming+laptop&qid=1583954768&sr=8-19,4.2,69,HP,15-dc1030nr / 15-dc1040nr,"Hyper-realistic Graphics: NVIDIA GeForce RTX 2060 (6 GB GDDR6 dedicated). enjoy new levels of gaming realism and performance with real-time ray-tracing technologies. Vr Ready. 15.6-Inch diagonal FHD IPS Anti-Glare micro-edge WLED-backlit Display (1920 x 1080) with 60Hz refresh rate 
 Omen command center: easily turn up your performance with included software that enables control over your CPU overclocking settings and prioritizes your gaming traffic to minimize latency 
 Cutting-edge gaming performance: play The latest games, including Fortnight, PUBG, and Overwatch, from anywhere—without sacrificing performance 
 Super Fast Processor: 8th Generation intel(r) core(tm) i7-8750H Processor, 6-Core, 2.2GHz up to 4.1GHz for superior gaming performance 
 Memory: 16 GB DDR4-2666 SDRAM (upgradable with 2 accessible Memory Slots) 
 Hard Drive and storage: 128 GB PCIe NVMe M.2 SSD, and 1 TB 7200 RPM SATA HDD 
 Ports: headphone/Microphone combo, Microphone jack, 2 USB 3.1 Gen 1 (side), 1 RJ-45 (rear), 1 USB 3.1 Gen 1 (rear), 1 HDMI 2.0 (rear), 1 Mini displayport(tm) (rear), 1 USB 3.1 Type-C(tm) (rear), 1 media card Reader 
 Dimensions AND weight (unpackaged): 14.17 inches (W) x 10.35 inches (D) x 1.02 inch (H); 5.31 pounds 
 Operating System and Warranty: Windows 10 Home and 1-Year Limited hardware warranty with 24-hour, 7 days a week Web support",FREE Shipping,FREE Returns,Only 12 left in stock - order soon.
